{
  "variant_id": "ai-brisk",
  "variant_name": "明快变体",
  "intent": {
    "hypothesis": "给熟练玩家的明快变体:节奏比基线更快、消除频繁、惊喜足,但保持公平,单局仍碎片化(P90 不超过 60 步)",
    "targets": [
      {
        "proxy": "rescueRate",
        "band": [
          0,
          0.1
        ],
        "represents": "公平感 —— 大片偏重下 RNG 仍可控,安全网介入率低"
      },
      {
        "proxy": "clearRate",
        "band": [
          0.45,
          0.75
        ],
        "represents": "节奏明快 —— 消除密度明显高于基线,熟练玩家不觉闷"
      },
      {
        "proxy": "rewardEntropy",
        "band": [
          0.35,
          null
        ],
        "represents": "惊喜充足 —— extended 形状集带来多样消除规模,不单调"
      },
      {
        "proxy": "stepsP90",
        "band": [
          10,
          60
        ],
        "represents": "单局碎片化 —— P90 不拖到 60 步以上,适合短暂介入"
      }
    ]
  },
  "board": {
    "width": 7,
    "height": 7,
    "cell_size_px": 60
  },
  "spawn": {
    "density": 0.65,
    "shape_set": "extended",
    "preview_count": 3,
    "big_piece_weight_mult": 2.0
  },
  "scoring": {
    "placement_per_cell": 1,
    "clear_base_factor": 6,
    "combo_curve": "quadratic"
  },
  "difficulty": {
    "dda_enabled": true,
    "dda_high_occupancy": 0.65,
    "dda_low_occupancy": 0.3
  },
  "juice": {
    "line_clear_trauma": 0.4,
    "hit_stop_ms": 40,
    "particles_per_cell": 12,
    "flash_alpha": 0.4,
    "line_clear_delay_ms": 60
  }
}
