{
  "variant_id": "control",
  "variant_name": "对照组",
  "board": { "width": 8, "height": 8, "cell_size_px": 60 },
  "spawn": { "density": 0.5, "shape_set": "standard", "preview_count": 3, "big_piece_weight_mult": 1.0 },
  "scoring": { "placement_per_cell": 1, "clear_base_factor": 5, "combo_curve": "stepped" },
  "difficulty": { "dda_enabled": true, "dda_high_occupancy": 0.75, "dda_low_occupancy": 0.35 },
  "juice": { "line_clear_trauma": 0.3, "hit_stop_ms": 50, "particles_per_cell": 10, "flash_alpha": 0.3, "line_clear_delay_ms": 80 }
}
