{
  "variant_id": "relaxed",
  "variant_name": "宽松版",
  "board": { "width": 10, "height": 10, "cell_size_px": 60 },
  "spawn": { "density": 0.3, "shape_set": "minimal", "preview_count": 3, "big_piece_weight_mult": 0.7 },
  "scoring": { "placement_per_cell": 1, "clear_base_factor": 5, "combo_curve": "linear" },
  "difficulty": { "dda_enabled": true, "dda_high_occupancy": 0.75, "dda_low_occupancy": 0.35 },
  "juice": { "line_clear_trauma": 0.25, "hit_stop_ms": 40, "particles_per_cell": 8, "flash_alpha": 0.25, "line_clear_delay_ms": 100 }
}
